//Connect to MySQL from terminal
sudo -u root -p

//Create Database 
mysql> create database university_25073;

//use database;
mysql> use university_25073;

//show tables;
mysql> show tables;
+----------------------------+
| Tables_in_university_25073 |
+----------------------------+
| classroom                  |
| course                     |
| department                 |
| instructor                 |
| section                    |
| student                    |
| takes                      |
| teaches                    |
| time_slot                  |
+----------------------------+
9 rows in set (0.00 sec)

//creating user
mysql> create user Orion identified by "orion";
Query OK, 0 rows affected (0.00 sec)
<!------------------------DCL Commands-------------------------!>
//Grants all permissions on given database to user Orion
mysql> grant all on 25073_Assignment3.* to Orion;

//revokes all the permissions on given database to user Orion
mysql> revoke all privileges on 25073_Assignment3.* from Orion;

//drops user 
mysql> drop user Orion;



<!-------------------------------------------------------Department table---------------------------------------------------->

mysql> create table department(dept_name varchar(20) primary key, building int,
budget int );


//desc
mysql> desc department;
+-----------+-------------+------+-----+---------+-------+
| Field     | Type        | Null | Key | Default | Extra |
+-----------+-------------+------+-----+---------+-------+
| dept_name | varchar(20) | NO   | PRI | NULL    |       |
| building  | int(11)     | YES  |     | NULL    |       |
| budget    | int(11)     | YES  |     | NULL    |       |
+-----------+-------------+------+-----+---------+-------+



//Insert dept
mysql> insert into department values ("Biology", 5, 700000),("Computer", 1, 500000),("History", 4, 300000),("Music", 2, 100000),("Physics", 3, 400000);

//display
mysql> select * from department;
+-----------+----------+--------+
| dept_name | building | budget |
+-----------+----------+--------+
| Biology   |        5 | 700000 |
| Computer  |        1 | 500000 |
| History   |        4 | 300000 |
| Music     |        2 | 100000 |
| Physics   |        3 | 400000 |
+-----------+----------+--------+


//Index
mysql> create index dept on department(dept_name);
Query OK, 0 rows affected (0.28 sec)
Records: 0  Duplicates: 0  Warnings: 0










<!---------------------------------------------------------Student table--------------------------------------------------->
mysql> create table student(sid varchar(10) primary key, name varchar(20) NOT NULL, tot_creds int , dept_name varchar(20) , foreign key(dept_name) references department(dept_name));


//desc
mysql> desc student;
+-----------+-------------+------+-----+---------+-------+
| Field     | Type        | Null | Key | Default | Extra |
+-----------+-------------+------+-----+---------+-------+
| sid       | varchar(10) | NO   | PRI | NULL    |       |
| name      | varchar(20) | Nmysql> create index instructor on instructor(ins_id);O   |     | NULL    |       |
| tot_creds | int(11)     | YES  |     | NULL    |       |
| dept_name | varchar(20) | YES  | MUL | NULL    |       |
+-----------+-------------+------+-----+---------+-------+


//insert student
mysql> insert into student(sid,name,tot_creds,dept_name) values ("S1", "Govardhan",8,"Music"), ("S2", "Rajesh", 9, "Computer"),( "S3", "Chintan", 9,"Music"), ("S4", "Kartika",9,"Physics"), ("S5", "Priya", 7, "Biology"), ( "S6", "Dagadrao", 6,"Computer"), ("S7", "Maaz",9,"History");




//display
select * from student;
+-----+-----------+-----------+-----------+
| sid | name      | tot_creds | dept_name |
+-----+-----------+-----------+-----------+
| S1  | Govardhan |         8 | Music     |
| S2  | Rajesh    |         9 | Computer  |
| S3  | Chintan   |         9 | Music     |
| S4  | Kartika   |         9 | Physics   |
| S5  | Priya     |         7 | Biology   |
| S6  | Dagadrao  |         6 | Computer  |
| S7  | Maaz      |         9 | History   |
+-----+-----------+-----------+-----------+

//Index

mysql> create index studentID on student(sid);
Query OK, 0 rows affected (0.32 sec)
Records: 0  Duplicates: 0  Warnings: 0



<!---------------------------------------------Instructor table--------------------------------------------------------->
mysql> create table instructor(ins_id int primary key, ins_name varchar(20), salary int, foreign key(dept_name) references department(dept_name));

//desc

mysql> desc instructor;
+-----------+-------------+------+-----+---------+-------+
| Field     | Type        | Null | Key | Default | Extra |
+-----------+-------------+------+-----+---------+-------+
| ins_id    | int(11)     | NO   | PRI | NULL    |       |
| ins_name  | varchar(20) | NO   |     | NULL    |       |
| salary    | int(11)     | YES  |     | NULL    |       |
| dept_name | varchar(20) | YES  | MUL | NULL    |       |
+-----------+-------------+------+-----+---------+-------+

//Insert instructor
mysql> insert into instructor values (111,"ABC",65000,"Computer"), (112,"PQR",90000,"Music"), (113,"EFG",70000,"Physics"), (114,"XYZ",50000,"History"), (115,"LMN",90000,"Music"), (116,"UVW",70000,"Physics"), (117,"STU",55000,"Biology");


//display
mysql> select * from instructor;
+--------+----------+--------+-----------+
| ins_id | ins_name | salary | dept_name |
+--------+----------+--------+-----------+
|    111 | ABC      |  65000 | Computer  |
|    112 | PQR      |  90000 | Music     |
|    113 | EFG      |  70000 | Physics   |
|    114 | XYZ      |  50000 | History   |
|    115 | LMN      |  90000 | Music     |
|    116 | UVW      |  70000 | Physics   |
|    117 | STU      |  55000 | Biology   |
+--------+----------+--------+-----------+

//Updating salary
mysql> Update instructor Set salary = 25000 where dept_name = "Music";

//index
mysql> create index instructor on instructor(ins_id);
Query OK, 0 rows affected (0.31 sec)
Records: 0  Duplicates: 0  Warnings: 0


//updating values for query
mysql> Update instructor SET  ins_name = "ABCDE" where ins_id = 111;
Query OK, 1 row affected (0.04 sec)
Rows matched: 1  Changed: 1  Warnings: 0

mysql> Update instructor SET  ins_name = "PQRS" where ins_id = 112;
Query OK, 1 row affected (0.03 sec)




<!----------------------------------------------------Course table--------------------------------->
mysql> create table course(course_id varchar(10) primary key, title varchar(20) NOT NULL, credits int , dept_name varchar(20),  foreign key(dept_name) references department(dept_name));

mysql> Alter table course Modify course_id int;

//desc

mysql> desc course;
+-----------+-------------+------+-----+---------+-------+
| Field     | Type        | Null | Key | Default | Extra |
+-----------+-------------+------+-----+---------+-------+
| course_id | varchar(10) | NO   | PRI | NULL    |       |
| title     | varchar(20) | NO   |     | NULL    |       |
| credits   | int(11)     | YES  |     | NULL    |       |
| dept_name | varchar(20) | YES  | MUL | NULL    |       |
+-----------+-------------+------+-----+---------+-------+


//insert course
insert into course values  ("Bio-1","Intro to Bio",3,"Biology"), ("Bio-2","Genetics",4,"Biology"),  ("CS-1","Intro to CS",3,"Computer"),("CS-2","Robotics",4,"Computer"), ("His-1","World History", 4, "History"),("Mu-1","Music audio",3,"Music"), ("Mu-2","Music video promo",4,"Music"), ("Phy-2","Physics Principles", 4 ,"Physics");
mysql> Update instructor Set salary = 30000 where dept_name = "Music";


//display
mysql> select * from course;
+-----------+--------------------+---------+-----------+
| course_id | title              | credits | dept_name |
+-----------+--------------------+---------+-----------+
| Bio-1     | Intro to Bio       |       3 | Biology   |
| Bio-2     | Genetics           |       4 | Biology   |
| CS-1      | Intro to CS        |       3 | Computer  |
| CS-2      | Robotics           |       4 | Computer  |
| His-1     | World History      |       4 | History   |
| Mu-1      | Music audio        |       3 | Music     |
| Mu-2      | Music video promo  |       4 | Music     |
| Phy-2     | Physics Principles |       4 | Physics   |
+-----------+--------------------+---------+-----------+
//Index 
mysql> create index course on course(course_id);
Query OK, 0 rows affected (0.31 sec)
Records: 0  Duplicates: 0  Warnings: 0




<!-----------------------------------------------------Time-slot table-------------------------------->
mysql> create table time_slot(tid varchar(15) primary key , day varchar(20), start_time varchar(20), end_time varchar(20));

//desc
mysql> desc time_slot;
+------------+-------------+------+-----+---------+-------+
| Field      | Type        | Null | Key | Default | Extra |
+------------+-------------+------+-----+---------+-------+
| tid        | varchar(15) | NO   | PRI | NULL    |       |
| day        | varchar(20) | YES  |     | NULL    |       |
| start_time | varchar(20) | YES  |     | NULL    |       |
| end_time   | varchar(20) | YES  |     | NULL    |       |
+------------+-------------+------+-----+---------+-------+



//insert
mysql> insert into time_slot values ("t1","Monday","9:00:00","2:00:00"), ("t2","Monday","10:00:00","3:00:00"), ("t3","Thursday","9:00:00","2:00:00"), ("t4","Thursday","8:00:00","10:00:00"), ("t5","Friday","7:00:00","9:00:00");

//display 
mysql> select * from time_slot;
+-----+----------+------------+----------+
| tid | day      | start_time | end_time |
+-----+----------+------------+----------+
| t1  | Monday   | 9:00:00    | 2:00:00  |
| t2  | Monday   | 10:00:00   | 3:00:00  |
| t3  | Thursday | 9:00:00    | 2:00:00  |
| t4  | Thursday | 8:00:00    | 10:00:00 |
| t5  | Friday   | 7:00:00    | 9:00:00  |
+-----+----------+------------+----------+


//index
mysql> create index time on time_slot(tid);
Query OK, 0 rows affected (0.25 sec)
Records: 0  Duplicates: 0  Warnings: 0


<!---------------------------------------------------Classroom table---------------------------------------->


mysql> create table classroom(building int , room_no int , capacity int , primary key(building, room_no));

//desc
mysql> desc classroom;
+----------+---------+------+-----+---------+-------+
| Field    | Type    | Null | Key | Default | Extra |
+----------+---------+------+-----+---------+-------+
| building | int(11) | NO   | PRI | NULL    |       |
| room_no  | int(11) | NO   | PRI | NULL    |       |
| capacity | int(11) | YES  |     | NULL    |       |
+----------+---------+------+-----+---------+-------+


//Insert into classroom
mysql> Insert into classroom values(1, 11,120),(2, 21,120),(3, 32,60),(4, 42,180),(5, 52,60);
 
 //display
mysql> select * from classroom;
 +----------+---------+----------+
| building | room_no | capacity |
+----------+---------+----------+
|        1 |      11 |      120 |
|        2 |      21 |      120 |
|        3 |      32 |       60 |
|        4 |      42 |      180 |
|        5 |      52 |       60 |
+----------+---------+----------+

//Index
mysql> create index class on classroom(room_no);
Query OK, 0 rows affected (0.28 sec)
Records: 0  Duplicates: 0  Warnings: 0


<!------------------------------------------------------Section table--------------------------------------------->



mysql> create table section (sec_id varchar(10), semester varchar(10), year varchar(10), course_id varchar(10), building int, room_no int,  foreign key(building, room_no) references classroom(building, room_no), tid varchar(15), foreign key(tid)references time_slot(tid), foreign key(course_id) references course(course_id), primary key(sec_id, course_id,semester,year));

// Insert into section
mysql> insert into section values ("S11","I","FY","Bio-1",5,52,"t1"),("S11","I","FY","Bio-2",4,42,"t2") ,("S12","II","FY","Phy-2",3,32,"t3"), ("S13","III","SY","CS-1",1,11,"t4"), ("S13","II","SY","CS-2",3,32,"t5"), ("S14","II","TY","Mu-1",2,21,"t4"), ("S14","II","TY","Mu-2",2,21,"t2"), ("S14","I","FY","His-1",4,42,"t3"), ("S16","II","TY","Bio-1",5,52,"t3");

//Updating a wrong value
mysql> Update section SET sec_id = "S15" where course_id = "His-1" AND building = 4;

//display

mysql> select * from section;

+--------+----------+------+-----------+----------+---------+------+
| sec_id | semester | year | course_id | building | room_no | tid  |
+--------+----------+------+-----------+----------+---------+------+
| S11    | I        | FY   | Bio-1     |        5 |      52 | t1   |
| S11    | I        | FY   | Bio-2     |        4 |      42 | t2   |
| S12    | II       | FY   | Phy-2     |        3 |      32 | t3   |
| S13    | III      | SY   | CS-1      |        1 |      11 | t4   |
| S13    | II       | SY   | CS-2      |        3 |      32 | t5   |
| S14    | II       | TY   | Mu-1      |        2 |      21 | t4   |
| S14    | II       | TY   | Mu-2      |        2 |      21 | t2   |
| S15    | I        | FY   | His-1     |        4 |      42 | t3   |
| S16    | II       | TY   | Bio-1     |        5 |      52 | t3   |
+--------+----------+------+-----------+----------+---------+------+


//Index
mysql> create index sectionID on section(sec_id);
Query OK, 0 rows affected (0.25 sec)
Records: 0  Duplicates: 0  Warnings: 0



<-----------------------------------------------------------Takes table-------------------------------------------------------->


mysql> Create table takes (sid varchar(10), sec_id varchar(10), semester varchar(10), year varchar(10), course_id varchar(10), grade varchar(10),primary key(sid,sec_id, course_id,semester,year), Foreign key(sid) references student(sid), Foreign key (sec_id, course_id,semester,year) references section(sec_id, course_id,semester,year) );

//desc 
mysql> desc takes;
+-----------+-------------+------+-----+---------+-------+
| Field     | Type        | Null | Key | Default | Extra |
+-----------+-------------+------+-----+---------+-------+
| sid       | varchar(10) | NO   | PRI | NULL    |       |
| sec_id    | varchar(10) | NO   | PRI | NULL    |       |
| semester  | varchar(10) | NO   | PRI | NULL    |       |
| year      | varchar(10) | NO   | PRI | NULL    |       |
| course_id | varchar(10) | NO   | PRI | NULL    |       |
| grade     | varchar(10) | YES  |     | NULL    |       |
+-----------+-------------+------+-----+---------+-------+


//Insert into takes
mysql> insert into takes values ("S3","S14","II","TY","Mu-2","A"), ("S4","S12","II","FY","Phy-2","A+"), ("S5","S11","I","FY","Bio-1","A"), ("S5","S11","I","FY","Bio-2","B"), ("S5","S13","II","SY","CS-2","B"), ("S7","S15","I","FY","His-1","C");

//display
mysql> select * from takes;
+-----+--------+----------+------+-----------+-------+
| sid | sec_id | semester | year | course_id | grade |
+-----+--------+----------+------+-----------+-------+
| S3  | S14    | II       | TY   | Mu-2      | A     |
| S4  | S12    | II       | FY   | Phy-2     | A+    |
| S5  | S11    | I        | FY   | Bio-1     | A     |
| S5  | S11    | I        | FY   | Bio-2     | B     |
| S5  | S13    | II       | SY   | CS-2      | B     |
| S7  | S15    | I        | FY   | His-1     | C     |
+-----+--------+----------+------+-----------+-------+


//Deleting a record
mysql> Delete from takes Where sec_id = "S12";
Query OK, 1 row affected (0.03 sec)

mysql> select * from takes;
+-----+--------+----------+------+-----------+-------+
| sid | sec_id | semester | year | course_id | grade |
+-----+--------+----------+------+-----------+-------+
| S3  | S14    | II       | TY   | Mu-2      | A     |
| S5  | S11    | I        | FY   | Bio-1     | A     |
| S5  | S11    | I        | FY   | Bio-2     | B     |
| S5  | S13    | II       | SY   | CS-2      | B     |
| S7  | S15    | I        | FY   | His-1     | C     |
+-----+--------+----------+------+-----------+-------+
5 rows in set (0.00 sec)




//Index
mysql> create index takes on takes(sid,sec_id,course_id);
Query OK, 0 rows affected (0.38 sec)
Records: 0  Duplicates: 0  Warnings: 0



<!----------------------------------------------------------Teaches table------------------------------->


mysql> Create table teaches (ins_id int, sec_id varchar(10), semester varchar(10), year varchar(10), course_id varchar(10),primary key(ins_id,sec_id, course_id,semester,year), Foreign key(ins_id) references instructor(ins_id), Foreign key (sec_id, course_id,semester,year) references section(sec_id, course_id,semester,year) );

//desc
mysql> desc teaches;
+-----------+-------------+------+-----+---------+-------+
| Field     | Type        | Null | Key | Default | Extra |
+-----------+-------------+------+-----+---------+-------+
| ins_id    | int(11)     | NO   | PRI | NULL    |       |
| sec_id    | varchar(10) | NO   | PRI | NULL    |       |
| semester  | varchar(10) | NO   | PRI | NULL    |       |
| year      | varchar(10) | NO   | PRI | NULL    |       |
| course_id | varchar(10) | NO   | PRI | NULL    |       |
+-----------+-------------+------+-----+---------+-------+


//Insert
insert into teaches values (117,"S11","I","FY","Bio-1"), (117,"S11","I","FY","Bio-2"), (113,"S12","II","FY","Phy-2"), (111,"S13","II","SY","CS-2"), (115, "S14","II","TY","Mu-1");

//display
mysql> select  * from teaches;
+--------+--------+----------+------+-----------+
| ins_id | sec_id | semester | year | course_id |
+--------+--------+----------+------+-----------+
|    117 | S11    | I        | FY   | Bio-1     |
|    117 | S11    | I        | FY   | Bio-2     |
|    113 | S12    | II       | FY   | Phy-2     |
|    111 | S13    | II       | SY   | CS-2      |
|    115 | S14    | II       | TY   | Mu-1      |
+--------+--------+----------+------+-----------+


//Index
mysql> create index teaches on teaches(ins_id,sec_id,course_id);
Query OK, 0 rows affected (0.27 sec)
Records: 0  Duplicates: 0  Warnings: 0







---------------------------














-------------------------------------Assignment No.4----------------------------------------------


1. Find the names of instructor on computer department who have salary greater than 70000.
Ans:  
mysql> select ins_name from instructor where dept_name = "Computer";
+----------+
| ins_name |
+----------+
| ABC      |
+----------+


2. Find the names of instructors who are working in Physics Department.
Ans: 
mysql> select ins_name from instructor where dept_name = "Physics";
+----------+
| ins_name |
+----------+
| EFG      |
| UVW      |
+----------+


3. Find the names of department whose budget is greater than 5 lakhs
Ans: 
mysql> select dept_name from department Where budget > 500000;
+-----------+
| dept_name |
+-----------+
| Biology   |
+-----------+


4. Find the names of students studying in computer department
Ans:
mysql> select name from student where dept_name = "Computer";
+----------+
| name     |
+----------+
| Rajesh   |
| Dagadrao |
+----------+

5. Find the names of students studying in music department 
Ans:
mysql> select name from student where dept_name = "Music";
+-----------+
| name      |
+-----------+
| Govardhan |
| Chintan   |
+-----------+

6. Find capacity of room numbers
mysql> select room_no, capacity from classroom;
+---------+----------+
| room_no | capacity |
+---------+----------+
|      11 |      120 |
|      21 |      120 |
|      32 |       60 |
|      42 |      180 |
|      52 |       60 |
+---------+----------+


7. Find out titles of music department name of biology department
Ans:
mysql> select title from course where dept_name = "Biology";
+--------------+
| title        |
+--------------+
| Intro to Bio |
| Genetics     |
+--------------+


8. Find out titles of music department
Ans:
mysql> select title from course where dept_name = "Music";
+-------------------+
| title             |
+-------------------+
| Music audio       |
| Music video promo |
+-------------------+


9. Give increment of Rs. 10000 to those instructors whise salary is less than 40000
Ans:
//salary values from table instructor updated firs as no salary was less than 40000
mysql> Update instructor Set salary = 25000 where dept_name = "Music";

// query of given statement
mysql> Update instructor Set salary= salary + 10000 where salary<40000;
Query OK, 2 rows affected (0.04 sec)
Rows matched: 2  Changed: 2  Warnings: 0

mysql> Update instructor Set salary= salary + 10000 where salary<40000;
Query OK, 2 rows affected (0.04 sec)
Rows matched: 2  Changed: 2  Warnings: 0

mysql> select * from instructor;
+--------+----------+--------+-----------+
| ins_id | ins_name | salary | dept_name |
+--------+----------+--------+-----------+
|    111 | ABC      |  65000 | Computer  |
|    112 | PQR      |  35000 | Music     |
|    113 | EFG      |  70000 | Physics   |
|    114 | XYZ      |  50000 | History   |
|    115 | LMN      |  35000 | Music     |
|    116 | UVW      |  70000 | Physics   |
|    117 | STU      |  55000 | Biology   |
+--------+----------+--------+-----------+


10. Give increment of Rs. 10000 to those instructors whose salary is less than 40000 else increment of 20000
Ans: 
mysql> Update instructor Set salary= case  when salary<40000 then  salary +10000 else  salary + 20000 end;
Query OK, 7 rows affected (0.04 sec)
Rows matched: 7  Changed: 7  Warnings: 0

mysql> select * from instructor;
+--------+----------+--------+-----------+
| ins_id | ins_name | salary | dept_name |
+--------+----------+--------+-----------+
|    111 | ABC      |  85000 | Computer  |
|    112 | PQR      |  45000 | Music     |
|    113 | EFG      |  90000 | Physics   |
|    114 | XYZ      |  70000 | History   |
|    115 | LMN      |  45000 | Music     |
|    116 | UVW      |  90000 | Physics   |
|    117 | STU      |  75000 | Biology   |
+--------+----------+--------+-----------+
7 rows in set (0.00 sec)


11. Find names of instructor along with department name and building no.
Ans: 
mysql> Update instructor Set salary= case  when salary<40000 then  salary +10000 else  salary + 20000 end;
Query OK, 7 rows affected (0.04 sec)
Rows matched: 7  Changed: 7  Warnings: 0

mysql> select * from instructor;
+--------+----------+--------+-----------+
| ins_id | ins_name | salary | dept_name |
+--------+----------+--------+-----------+
|    111 | ABC      |  85000 | Computer  |
|    112 | PQR      |  45000 | Music     |
|    113 | EFG      |  90000 | Physics   |
|    114 | XYZ      |  70000 | History   |
|    115 | LMN      |  45000 | Music     |
|    116 | UVW      |  90000 | Physics   |
|    117 | STU      |  75000 | Biology   |
+--------+----------+--------+-----------+
7 rows in set (0.00 sec)

12. find the names of instructor along with department name and building no.
Ans: 
mysql> select instructor.ins_name, instructor.dept_name,department.building from
 instructor, department Where department.dept_name = instructor.dept_name;
+----------+-----------+----------+
| ins_name | dept_name | building |
+----------+-----------+----------+
| ABC      | Computer  |        1 |
| PQR      | Music     |        2 |
| EFG      | Physics   |        3 |
| XYZ      | History   |        4 |
| LMN      | Music     |        2 |
| UVW      | Physics   |        3 |
| STU      | Biology   |        5 |
+----------+-----------+----------+
7 rows in set (0.03 sec)

13. Find the instructor who has taught some courses
Ans: 

mysql> select ins_name, course_id from instructor, teaches Where instructor.ins_
id = teaches.ins_id;
+----------+-----------+
| ins_name | course_id |
+----------+-----------+
| ABC      | CS-2      |
| EFG      | Phy-2     |
| LMN      | Mu-1      |
| STU      | Bio-1     |
| STU      | Bio-2     |
+----------+-----------+
5 rows in set (0.01 sec)

14. For all instructor in university who have taught some courses find name and course_id of all courses they have taught 
Ans:
mysql> select ins_name, course_id from instructor, teaches Where instructor.ins_
id = teaches.ins_id;
+----------+-----------+
| ins_name | course_id |
+----------+-----------+
| ABC      | CS-2      |
| EFG      | Phy-2     |
| LMN      | Mu-1      |
| STU      | Bio-1     |
| STU      | Bio-2     |
+----------+-----------+


15. List all instructors along with title of courses that they teach  
Ans:
mysql> select ins_name, title from instructor, course, teaches where instructor.ins_id = teaches.ins_id AND course.course_id = teaches.course_id;
+----------+--------------------+
| ins_name | title              |
+----------+--------------------+
| ABC      | Robotics           |
| EFG      | Physics Principles |
| LMN      | Music audio        |
| STU      | Intro to Bio       |
| STU      | Genetics           |
+----------+--------------------+
5 rows in set (0.08 sec)

16. Find names of all departments whode name include substring i
Ans: 		
mysql> Select dept_name from department where dept_name Like "%i%";
+-----------+
| dept_name |
+-----------+
| Biology   |
| History   |
| Music     |
| Physics   |
+-----------+

17. Find names of instructor along with department name and building no. 
Ans: 
mysql> select * from instructor where LENGTH(ins_name) = 3;
+--------+----------+--------+-----------+
| ins_id | ins_name | salary | dept_name |
+--------+----------+--------+-----------+
|    113 | EFG      |  90000 | Physics   |
|    114 | XYZ      |  70000 | History   |
|    115 | LMN      |  45000 | Music     |
|    116 | UVW      |  90000 | Physics   |
|    117 | STU      |  75000 | Biology   |
+--------+----------+--------+-----------+

18. Find the titles along with department names where dept must end with 'y'
Ans:
mysql> select dept_name, title from course where Right(dept_name,1) = 'y' ;
+-----------+---------------+
| dept_name | title         |
+-----------+---------------+
| Biology   | Intro to Bio  |
| Biology   | Genetics      |
| History   | World History |
+-----------+---------------+
3 rows in set (0.00 sec)
	
19. List all the instructors in descending order
Ans:

mysql> select ins_id , ins_name from instructor ORDER By ins_id desc;
+--------+----------+
| ins_id | ins_name |
+--------+----------+
|    117 | STU      |
|    116 | UVW      |
|    115 | LMN      |
|    114 | XYZ      |
|    113 | EFG      |
|    112 | PQRS     |
|    111 | ABCDE    |
+--------+----------+
7 rows in set (0.00 sec)

20. Find the names of instructor with salary amount between 30000 and 50000
Ans:
 mysql> select ins_name from instructor where salary Between 30000 AND 50000;
+----------+
| ins_name |
+----------+
| PQRS     |
| LMN      |
+----------+


21. Display total salary of all staff members from instructor
Ans:
mysql> select salary  from instructor;
+--------+
| salary |
+--------+
|  85000 |
|  45000 |
|  90000 |
|  70000 |
|  45000 |
|  90000 |
|  75000 |
+--------+
7 rows in set (0.00 sec)

mysql> select SUM(salary) from instructor;
+-------------+
| SUM(salary) |
+-------------+
|      500000 |
+-------------+
1 row in set (0.00 sec)


22. Display total salary of those staff members who are from Music dept
Ans:
mysql> select SUM(salary) from instructor where dept_name = "Music";
+-------------+
| SUM(salary) |
+-------------+
|       90000 |
+-------------+
1 row in set (0.00 sec)

23. Write a query to find out the number of staff members who are from Physics Department
Ans:

mysql> select ins_name , dept_name  from instructor;
+----------+-----------+
| ins_name | dept_name |
+----------+-----------+
| ABCDE    | Computer  |
| PQRS     | Music     |
| EFG      | Physics   |
| XYZ      | History   |
| LMN      | Music     |
| UVW      | Physics   |
| STU      | Biology   |
+----------+-----------+
mysql> select COUNT(ins_id) from instructor where dept_name = "Physics";
+---------------+
| COUNT(ins_id) |
+---------------+
|             2 |
+---------------+
1 row in set (0.00 sec)


24. Write a query to display average salary of staff members
Ans:
mysql> select AVG(salary) from instructor ;
+-------------+
| AVG(salary) |
+-------------+
|  71428.5714 |
+-------------+
1 row in set (0.00 sec)

25. Write a query to find the minimum salary paid to the staff members
Ans:
mysql> select MIN(salary) As MinimumSalary from instructor ;
+--------------+
| MinimumSalary |
+--------------+
|        45000 |
+--------------+
1 row in set (0.00 sec)

26. Write a query to find the maximum salary paid to the staff members
Ans:
mysql> select Max(salary) As MaximumSalary from instructor ;
+---------------+
| MaximumSalary |
+---------------+
|         90000 |
+---------------+
1 row in set (0.00 sec)


27. Write a query to display max. and min. number of credits given to a student in each department/\
Ans:
mysql> select Max(salary) As MaximumSalary , Min(salary) As MinimumSalary from instructor ;
+---------------+---------------+
| MaximumSalary | MinimumSalary |
+---------------+---------------+
|         90000 |         45000 |
+---------------+---------------+
1 row in set (0.00 sec)

28. Display the names of instructors who do not have salary in between 50000 and 68000
Ans:
mysql> select ins_name,salary from instructor where salary > 50000 OR salary < 30000;
+----------+--------+
| ins_name | salary |
+----------+--------+
| ABCDE    |  85000 |
| PQRS     |  20000 |
| EFG      |  90000 |
| XYZ      |  70000 |
| LMN      |  20000 |
| UVW      |  90000 |
| STU      |  75000 |
+----------+--------+
7 rows in set (0.00 sec)


29. Fint out the set of all courses taught in sem I or sem II or both for TY
Ans:
mysql> (select course_id,semester,year from section where year = "TY") Union (select course_id , semester,year from section where semester = "I
" OR semester ="II") ;
+-----------+----------+------+
| course_id | semester | year |
+-----------+----------+------+
| Mu-1      | II       | TY   |
| Mu-2      | II       | TY   |
| Bio-1     | II       | TY   |
| Phy-2     | II       | FY   |
| CS-2      | II       | SY   |
| Bio-2     | I        | FY   |
| His-1     | I        | FY   |
| Bio-1     | I        | FY   |
+-----------+----------+------+
8 rows in set (0.00 sec)


30. Find the average salary in each Department
Ans:
mysql> select dept_name,AVG(salary) from instructor Group by dept_name having AVG(salary);
+-----------+-------------+
| dept_name | AVG(salary) |
+-----------+-------------+
| Biology   |  75000.0000 |
| Computer  |  85000.0000 |
| History   |  70000.0000 |
| Music     |  20000.0000 |
| Physics   |  90000.0000 |
+-----------+-------------+
5 rows in set (0.00 sec)


31. Find the average salary in each Department where average salary of all instructors is more than 40000
Ans: 
mysql> select dept_name,AVG(salary) from instructor Group by dept_name having AVG(salary) < 40000;
+-----------+-------------+
| dept_name | AVG(salary) |
+-----------+-------------+
| Music     |  20000.0000 |
+-----------+-------------+
1 row in set (0.00 sec)

32. Find the number of instructors with department name in each department
Ans: 
mysql> select  count(ins_id), dept_name from instructor  Group by dept_name havi
ng Count(ins_id);
+---------------+-----------+
| count(ins_id) | dept_name |
+---------------+-----------+
|             1 | Biology   |
|             1 | Computer  |
|             1 | History   |
|             2 | Music     |
|             2 | Physics   |
+---------------+-----------+
5 rows in set (0.00 sec)

33. Find out department name with average salary where average salary is not between 10000 and 100000
Ans: 
// Updating values in salary as no salary was under 10000
mysql> Update instructor SET salary = 9000 where ins_id = 115;
Query OK, 1 row affected (0.06 sec)
Rows matched: 1  Changed: 1  Warnings: 0

//Excecuting query 
mysql> select salary , dept_name from instructor where salary NOT Between 10000
AND 100000;
+--------+-----------+
| salary | dept_name |
+--------+-----------+
|   9000 | Music     |
+--------+-----------+
1 row in set (0.00 sec)

34. Find out the courses taught both in sem I of FY and semII of TY
Ans: 
mysql> select course_id from teaches where year="FY" AND semester = "I" OR year="TY" AND semester = "II" ;
+-----------+
| course_id |
+-----------+
| Mu-1      |
| Bio-1     |
| Bio-2     |
+-----------+
3 rows in set (0.00 sec)

35. Find out the set of courses taught in sem I of FY but not in sem II of TY.
Ans:
mysql> select title from course,teaches where year="FY" AND semester = "I" AND year!="TY" AND semester != "II" AND course.course_id = teaches.course_id;
+--------------+
| title        |
+--------------+
| Intro to Bio |
| Genetics     |
+--------------+
2 rows in set (0.00 sec)


36. Find the name of all the instructors together with course_id of all they teach
Ans:

mysql> select ins_name,course_id from instructor,teaches Where instructor.ins_id = teaches.ins_id;
+----------+-----------+
| ins_name | course_id |
+----------+-----------+
| ABCDE    | CS-2      |
| EFG      | Phy-2     |
| LMN      | Mu-1      |
| STU      | Bio-1     |
| STU      | Bio-2     |
+----------+-----------+
5 rows in set (0.01 sec)

37. List the name of the instructors along with the titles of the cuorse they teach
Ans: 
mysql> select ins_name,title from instructor,course, teaches Where instructor.ins_id = teaches.ins_id AND course.course_id = teaches.course_id;
+----------+--------------------+
| ins_name | title              |
+----------+--------------------+
| ABCDE    | Robotics           |
| EFG      | Physics Principles |
| LMN      | Music audio        |
| STU      | Intro to Bio       |
| STU      | Genetics           |
+----------+--------------------+
5 rows in set (0.01 sec)
 
38. Left Outer Join 
Ans:
mysql> select instructor.ins_name , instructor.dept_name from instructor LEFT Jo
in department ON department.dept_name = instructor.dept_name;
+----------+-----------+
| ins_name | dept_name |
+----------+-----------+
| ABCDE    | Computer  |
| PQRS     | Music     |
| EFG      | Physics   |
| XYZ      | History   |
| LMN      | Music     |
| UVW      | Physics   |
| STU      | Biology   |
+----------+-----------+
7 rows in set (0.00 sec)

39. Right Outer Join
mysql> select course.title , course.course_id  from course Right Join department ON department.dept_name = course.dept_name;
+--------------------+-----------+
| title              | course_id |
+--------------------+-----------+
| Intro to Bio       | Bio-1     |
| Genetics           | Bio-2     |
| Intro to CS        | CS-1      |
| Robotics           | CS-2      |
| World History      | His-1     |
| Music audio        | Mu-1      |
| Music video promo  | Mu-2      |
| Physics Principles | Phy-2     |
+--------------------+-----------+
8 rows in set (0.00 sec)

40. Inner Join

mysql> select teaches.course_id, teaches.year from teaches Inner Join course On
course.course_id = teaches.course_id;
+-----------+------+
| course_id | year |
+-----------+------+
| CS-2      | SY   |
| Phy-2     | FY   |
| Mu-1      | TY   |
| Bio-1     | FY   |
| Bio-2     | FY   |
+-----------+------+
5 rows in set (0.00 sec)

//String Functions

41. Display names of all the students in UPPERCASE.
Ans: 
mysql> select Upper(name) As UpperCase_Names from student;
+-----------------+
| UpperCase_Names |
+-----------------+
| GOVARDHAN       |
| RAJESH          |
| CHINTAN         |
| KARTIKA         |
| PRIYA           |
| DAGADRAO        |
| MAAZ            |
+-----------------+
7 rows in set (0.00 sec)

42.  Display names of all the students in lowercase.
Ans: 
mysql> select lower(name) As LowerCase_Names from student;
+-----------------+
| LowerCase_Names |
+-----------------+
| govardhan       |
| rajesh          |
| chintan         |
| kartika         |
| priya           |
| dagadrao        |
| maaz            |
+-----------------+
7 rows in set (0.00 sec)

43. Find the length of the titles of the courses.
Ans:
mysql> select title, length(title) As TotalCharacters from course;
+--------------------+-----------------+
| title              | TotalCharacters |
+--------------------+-----------------+
| Intro to Bio       |              12 |
| Genetics           |               8 |
| Intro to CS        |              11 |
| Robotics           |               8 |
| World History      |              13 |
| Music audio        |              11 |
| Music video promo  |              17 |
| Physics Principles |              18 |
+--------------------+-----------------+
8 rows in set (0.00 sec)

44. Perform the left padding on student table for student with sid as S5.
Ans:
mysql> select LPAD(name,10,"e") from student where sid =  "S5";
+-------------------+
| LPAD(name,10,"e") |
+-------------------+
| eeeeePriya        |
+-------------------+
1 row in set (0.00 sec)

45. Perform the left padding on student table for student with sid as S5.
Ans:
mysql> select RPAD(name,12,"Dada") from student where sid =  "S6";
+----------------------+
| RPAD(name,12,"Dada") |
+----------------------+
| DagadraoDada         |
+----------------------+
1 row in set (0.00 sec)

46. Use substring operation for department names.
Ans:
mysql> select Substring(dept_name, 1,3) from department;
+---------------------------+
| Substring(dept_name, 1,3) |
+---------------------------+
| Bio                       |
| Com                       |
| His                       |
| Mus                       |
| Phy                       |
+---------------------------+
5 rows in set (0.00 sec)

47. Replace any words in titlle column of the course table
Ans:
mysql> select Replace(title,"History","is Flat") from course;
+------------------------------------+
| Replace(title,"History","is Flat") |
+------------------------------------+
| Intro to Bio                       |
| Genetics                           |
| Intro to CS                        |
| Robotics                           |
| World is Flat                      |
| Music audio                        |
| Music video promo                  |
| Physics Principles                 |
+------------------------------------+
8 rows in set (0.00 sec)

48. Display current date and time.
Ans:
mysql> select sysdate() As Date_AND_time;
+---------------------+
| Date_AND_time       |
+---------------------+
| 2022-04-13 11:22:04 |
+---------------------+
1 row in set (0.00 sec)

49. Display the joining date of staff member whose name is 'ABC'.
Ans:

50. Display the name of staf members with department name and joining date, joining date should be displayed in USA
Ans:

